{
    "Entity type": {
        "Value property": {
            "Value type": [
                "http://crowd.fi.uncoma.edu.ar/kb1#Name"
            ]
        },
        "Data type": [
            "http://www.w3.org/2001/XMLSchema#string"
        ],
        "Object type": [
            "http://crowd.fi.uncoma.edu.ar/kb1#Person"
        ]
    },
    "Role": [
        {
            "object type cardinality": [
                "wT4zDa"
            ],
            "rolename": "http://crowd.fi.uncoma.edu.ar/kb1#Person_role",
            "entity type": "http://crowd.fi.uncoma.edu.ar/kb1#Person",
            "relationship": "http://crowd.fi.uncoma.edu.ar/kb1#Name_valueTypeRel"
        },
        {
            "object type cardinality": [
                "VjgvyB"
            ],
            "rolename": "http://crowd.fi.uncoma.edu.ar/kb1#Name_role",
            "entity type": "http://crowd.fi.uncoma.edu.ar/kb1#Name",
            "relationship": "http://crowd.fi.uncoma.edu.ar/kb1#Name_valueTypeRel"
        }
    ],
    "Constraints": {
        "Cardinality constraints": {
            "Attributive property cardinality": [],
            "Object type cardinality": [
                {
                    "name": "wT4zDa",
                    "maximum": "1",
                    "minimum": "0"
                },
                {
                    "name": "VjgvyB",
                    "maximum": "1",
                    "minimum": "0"
                }
            ]
        },
        "Disjointness constraints": {
            "Disjoint object type": [],
            "Disjoint role": []
        },
        "Completeness constraints": [],
        "Mandatory constraints": {
            "Mandatory": []
        }
    },
    "Relationship": {
        "Attributive property": {
            "Attributive property": [],
            "Attribute": {
                "Attribute": [],
                "Mapped to": [
                    {
                        "domain": [
                            "http://crowd.fi.uncoma.edu.ar/kb1#Name"
                        ],
                        "name": "http://crowd.fi.uncoma.edu.ar/kb1#Name_mappedTo",
                        "range": "http://www.w3.org/2001/XMLSchema#string"
                    }
                ]
            }
        },
        "Subsumption": [],
        "Relationship": [
            {
                "entities": [
                    "http://crowd.fi.uncoma.edu.ar/kb1#Person",
                    "http://crowd.fi.uncoma.edu.ar/kb1#Name"
                ],
                "name": "http://crowd.fi.uncoma.edu.ar/kb1#Name_valueTypeRel"
            }
        ]
    }
}
