{
    "Entity type": {
        "Value property": {
            "Value type": []
        },
        "Data type": [],
        "Object type": [
            "http://crowd.fi.uncoma.edu.ar/kb1#Institution",
            "http://crowd.fi.uncoma.edu.ar/kb1#Person"
        ]
    },
    "Role": [
        {
            "object type cardinality": [
                "card1"
            ],
            "rolename": "http://crowd.fi.uncoma.edu.ar/kb1#person",
            "entity type": "http://crowd.fi.uncoma.edu.ar/kb1#Person",
            "relationship": "http://crowd.fi.uncoma.edu.ar/kb1#enrolled"
        },
        {
            "object type cardinality": [
                "card2"
            ],
            "rolename": "http://crowd.fi.uncoma.edu.ar/kb1#institution",
            "entity type": "http://crowd.fi.uncoma.edu.ar/kb1#Institution",
            "relationship": "http://crowd.fi.uncoma.edu.ar/kb1#enrolled"
        }
    ],
    "Constraints": {
        "Cardinality constraints": {
            "Attibutive property cardinality": [],
            "Object type cardinality": [
                {
                    "name": "card1",
                    "maximum": "*",
                    "minimum": "0"
                },
                {
                    "name": "card2",
                    "maximum": "*",
                    "minimum": "0"
                }
            ]
        },
        "Disjointness constraints": {
            "Disjoint object type": [],
            "Disjoint role": []
        },
        "Completeness constraints": [],
        "Mandatory constraints": {
            "Mandatory": []
        }
    },
    "Relationship": {
        "Attributive property": {
            "Attributive property": [],
            "Attribute": {
                "Attribute": [],
                "Mapped to": []
            }
        },
        "Subsumption": [],
        "Relationship": [
            {
                "entities": [
                    "http://crowd.fi.uncoma.edu.ar/kb1#Person",
                    "http://crowd.fi.uncoma.edu.ar/kb1#Institution"
                ],
                "name": "http://crowd.fi.uncoma.edu.ar/kb1#enrolled"
            }
        ]
    }
}
