{
  "Entity type": {
    "Value property": {
      "Value type": []
    },
    "Data type": [],
    "Object type": [
      "http://crowd.fi.uncoma.edu.ar/kb1#Institution",
      "http://crowd.fi.uncoma.edu.ar/kb1#Person",
      "http://crowd.fi.uncoma.edu.ar/kb1#Employee",
      "http://crowd.fi.uncoma.edu.ar/kb1#Faculty"
    ]
  },
  "Role": [
    {
      "rolename": "http://crowd.fi.uncoma.edu.ar/kb1#person",
      "relationship": "http://crowd.fi.uncoma.edu.ar/kb1#enrolled",
      "entity type": "http://crowd.fi.uncoma.edu.ar/kb1#Person",
      "object type cardinality": [
        "http://crowd.fi.uncoma.edu.ar/kb1#card1"
      ]
    },
    {
      "rolename": "http://crowd.fi.uncoma.edu.ar/kb1#institution",
      "relationship": "http://crowd.fi.uncoma.edu.ar/kb1#enrolled",
      "entity type": "http://crowd.fi.uncoma.edu.ar/kb1#Institution",
      "object type cardinality": [
        "http://crowd.fi.uncoma.edu.ar/kb1#card2"
      ]
    },
    {
      "rolename": "http://crowd.fi.uncoma.edu.ar/kb1#employee",
      "relationship": "http://crowd.fi.uncoma.edu.ar/kb1#works",
      "entity type": "http://crowd.fi.uncoma.edu.ar/kb1#Employee",
      "object type cardinality": [
        "http://crowd.fi.uncoma.edu.ar/kb1#card3"
      ]
    },
    {
      "rolename": "http://crowd.fi.uncoma.edu.ar/kb1#faculty",
      "relationship": "http://crowd.fi.uncoma.edu.ar/kb1#works",
      "entity type": "http://crowd.fi.uncoma.edu.ar/kb1#Faculty",
      "object type cardinality": [
        "http://crowd.fi.uncoma.edu.ar/kb1#card4"
      ]
    }
  ],
  "Constraints": {
    "Cardinality constraints": {
      "Attibutive property cardinality": [],
      "Object type cardinality": [
        {
          "name": "http://crowd.fi.uncoma.edu.ar/kb1#card1",
          "minimum": "0",
          "maximum": "N"
        },
        {
          "name": "http://crowd.fi.uncoma.edu.ar/kb1#card2",
          "minimum": "0",
          "maximum": "N"
        },
        {
          "name": "http://crowd.fi.uncoma.edu.ar/kb1#card3",
          "minimum": "0",
          "maximum": "N"
        },
        {
          "name": "http://crowd.fi.uncoma.edu.ar/kb1#card4",
          "minimum": "0",
          "maximum": "N"
        }
      ]
    },
    "Disjointness constraints": {
      "Disjoint object type": [],
      "Disjoint role": []
    },
    "Completeness constraints": [],
    "Mandatory constraints": {
      "Mandatory": []
    }
  },
  "Relationship": {
    "Attributive property": {
      "Attributive property": [],
      "Attribute": {
        "Attribute": [],
        "Mapped to": []
      }
    },
    "Subsumption": [
      {
        "name": "http://crowd.fi.uncoma.edu.ar/kb1#r1",
        "entity parent": "http://crowd.fi.uncoma.edu.ar/kb1#Institution",
        "entity child": "http://crowd.fi.uncoma.edu.ar/kb1#Faculty",
        "disjointness constraints": "",
        "completeness constraints": ""
      },
      {
        "name": "http://crowd.fi.uncoma.edu.ar/kb1#r2",
        "entity parent": "http://crowd.fi.uncoma.edu.ar/kb1#Person",
        "entity child": "http://crowd.fi.uncoma.edu.ar/kb1#Employee",
        "disjointness constraints": "",
        "completeness constraints": ""
      },
      {
        "name": "http://crowd.fi.uncoma.edu.ar/kb1#role2",
        "entity parent": "http://crowd.fi.uncoma.edu.ar/kb1#person",
        "entity child": "http://crowd.fi.uncoma.edu.ar/kb1#employee"
      }
    ],
    "Relationship": [
      {
        "name": "http://crowd.fi.uncoma.edu.ar/kb1#enrolled",
        "entities": [
          "http://crowd.fi.uncoma.edu.ar/kb1#Person",
          "http://crowd.fi.uncoma.edu.ar/kb1#Institution"
        ]
      },
      {
        "name": "http://crowd.fi.uncoma.edu.ar/kb1#works",
        "entities": [
          "http://crowd.fi.uncoma.edu.ar/kb1#Employee",
          "http://crowd.fi.uncoma.edu.ar/kb1#Faculty"
        ]
      }
    ]
  }
}
