{
    "Entity type": {
        "Value property": {
            "Value type": []
        },
        "Data type": [],
        "Object type": [
            "http://crowd.fi.uncoma.edu.ar/kb1#Dog",
            "http://crowd.fi.uncoma.edu.ar/kb1#Person"
        ]
    },
    "Role": [],
    "Constraints": {
        "Cardinality constraints": {
            "Attibutive property cardinality": [],
            "Object type cardinality": []
        },
        "Disjointness constraints": {
            "Disjoint object type": [],
            "Disjoint role": []
        },
        "Completeness constraints": [],
        "Mandatory constraints": {
            "Mandatory": []
        }
    },
    "Relationship": {
        "Attributive property": {
            "Attributive property": [],
            "Attribute": {
                "Attribute": [],
                "Mapped to": []
            }
        },
        "Subsumption": [],
        "Relationship": []
    }
}
