{
    "Entity type": {
        "Value property": {
            "Value type": []
        },
        "Data type": [],
        "Object type": [
            "http://crowd.fi.uncoma.edu.ar/kb1#Dog",
            "http://crowd.fi.uncoma.edu.ar/kb1#Person",
            "http://crowd.fi.uncoma.edu.ar/kb1#Cat"
        ]
    },
    "Role": [],
    "Constraints": {
        "Cardinality constraints": {
            "Attibutive property cardinality": [],
            "Object type cardinality": []
        },
        "Disjointness constraints": {
            "Disjoint object type": [
                {
                    "entities": [
                        "http://crowd.fi.uncoma.edu.ar/kb1#Dog",
                        "http://crowd.fi.uncoma.edu.ar/kb1#Cat"
                    ],
                    "name": "dc1"
                }
            ],
            "Disjoint role": []
        },
        "Completeness constraints": [
            {
                "entities": [
                    "http://crowd.fi.uncoma.edu.ar/kb1#Dog",
                    "http://crowd.fi.uncoma.edu.ar/kb1#Cat"
                ],
                "name": "cc2"
            }
        ],
        "Mandatory constraints": {
            "Mandatory": []
        }
    },
    "Relationship": {
        "Attributive property": {
            "Attributive property": [],
            "Attribute": {
                "Attribute": [],
                "Mapped to": []
            }
        },
        "Subsumption": [
            {
                "entity child": "http://crowd.fi.uncoma.edu.ar/kb1#Dog",
                "disjointness constraints": "dc1",
                "completeness constraints": "cc2",
                "name": "http://crowd.fi.uncoma.edu.ar/kb1#S1_YMgP",
                "entity parent": "http://crowd.fi.uncoma.edu.ar/kb1#Person"
            },
            {
                "entity child": "http://crowd.fi.uncoma.edu.ar/kb1#Cat",
                "disjointness constraints": "dc1",
                "completeness constraints": "cc2",
                "name": "http://crowd.fi.uncoma.edu.ar/kb1#S1_Tur0",
                "entity parent": "http://crowd.fi.uncoma.edu.ar/kb1#Person"
            }
        ],
        "Relationship": []
    }
}
